id,name,contact_info,expertise,membership,experience,style_approach,availability,created_at,updated_at
65,Manpreet Kaur Bhasin,sarah03@hotmail.com,"I am a practicing lawyer at the High Court of Delhi in India since the year 2002. I started my career with a law firm in Delhi, practicing in the field of Intellectual Property, Civil Laws, Service Laws, Commercial Laws, Family Laws, Sports Law & Education Laws.  During my practice in the various courts of Delhi, I have been a part of several court directed mediations in order to enable the parties to reach an amicable dispute resolution.","Areas of expertise Family Law, Contracts & Agreements,Property, Wills,Intellectual Property. Country of Practice IndiaLanguagesEnglish (Fluent)Hindi (Fluent)Punjabi (Fluent)","I am a practicing lawyer at the High Court of Delhi in India since the year 2002. I started my career with a law firm in Delhi, practicing in the field of Intellectual Property, Civil Laws, Service Laws, Commercial Laws, Family Laws, Sports Law & Education Laws.  During my practice in the various courts of Delhi, I have been a part of several court directed mediations in order to enable the parties to reach an amicable dispute resolution.","Each one of us face difficult times in our lives but none of us want to struggle with these problems for long. Mediation is an effective tool to put an end to our problems gracefully without facing fierce legal battles stretched over several years. Moreover, litigation between parties entails a lot of costs and more importantly it wastes a lot of precious time of the parties. Litigation has a long route and keeping this in mind even our Hon’ble Courts are supporting and encouraging settlement of cases through mediation as far as possible.Mediation facilitates settlement of disputes by giving space to the parties in which they can reflect upon themselves and their differences in an altogether different manner. The Mediator initiates fresh round of discussion and dialogue between parties which usually they are not able to do without the presence of third neutral party. Mediation acts as a mirror for its clients where parties can reflect upon themselves and think deeply to figure out possible solutions to their problems. As a Mediator, I have worked with parties that are not able to talk without the presence of a third party. In such situations, I may structure the conversation, ask such questions that are intended to create focus, clarify differences, standpoints and interests, and shift the perspective of the parties towards each other. In the process of mediation, communication amongst the parties is challenging and may take an aggressive form but as a Mediator, I stand between the parties, filtering, their words and actions. As a Mediator, I acknowledge the feelings of the parties, their thoughts, their discomfort and inhibitions. But despite all this, I strive to create a conducive environment to continue and conclude their talks.  ","[{'day': 'Monday', 'slots': ['09:00-11:00', '13:00-15:00', '16:00-18:00']}, {'day': 'Tuesday', 'slots': ['10:00-12:00', '14:00-16:00']}, {'day': 'Wednesday', 'slots': ['09:00-11:00', '13:00-15:00']}, {'day': 'Thursday', 'slots': ['10:00-12:00', '14:00-16:00', '17:00-19:00']}, {'day': 'Friday', 'slots': ['09:00-11:00', '12:00-14:00']}]",2024-05-26T09:44:17.442861,2024-05-26T09:44:17.442868
66,??Michael Chan,johnsonangela@stone-kirby.info,"Profession/s Actuary, FSAAreas of expertise Civil/CommercialCountry of Practice United Kingdom, Hong Kong, SingaporeLanguagesEnglish, Chinese (Cantonese), Chinese (Mandarin)","Profession/s Actuary, FSAAreas of expertise Civil/CommercialCountry of Practice United Kingdom, Hong Kong, SingaporeLanguagesEnglish, Chinese (Cantonese), Chinese (Mandarin)",I work as a qualified actuary providing actuarial services outside my mediator profession. ,"In my role as an actuary and mediator, I bring a unique approach in my mediation style. I see each dispute as a complex problem. However, I also emphasize connecting with individuals on a personal level, understanding their emotions. This combination of analytical mindset and empathetic understanding allows me to build trust with those I mediate for.","[{'day': 'Monday', 'slots': ['09:00-11:00', '13:00-15:00', '16:00-18:00']}, {'day': 'Tuesday', 'slots': ['10:00-12:00', '14:00-16:00']}, {'day': 'Wednesday', 'slots': ['09:00-11:00', '13:00-15:00']}, {'day': 'Thursday', 'slots': ['10:00-12:00', '14:00-16:00', '17:00-19:00']}, {'day': 'Friday', 'slots': ['09:00-11:00', '12:00-14:00']}]",2024-05-26T09:44:17.444593,2024-05-26T09:44:17.444606
67,Michael Ruddick,angela38@howard-brown.org,"Michael’s area of expertise is currently in low-level civil disputes and has qualified as a Civil and Commercial mediator. Whilst not currently experienced, Michael is a professional and dedicated mediator who is willing to refund fees for clients who are not satisfied with the service they receive.LanguagesEnglish",ADR-ODR International Panel Mediator (2018 to present)Called to the Bar by Lincoln’s Inn in 2018,Court Advocate (LPC Law Solicitors - 2018 to present)Michael is an Advocate for LPC Law and as a result sees what happens when litigation is taken all the way to Court. As such he is acutely aware of the benefits of mediation and how it can be a powerful force for resolving disputes amicably. His personal style and dedication to reaching a resolution reflects this for his clients. ,"Michael espouses an easygoing mediation style which aims to invite everyone as an equal into the mediation. Michael aims to ask the questions needed to get to the heart of the matter, but ultimately wants to place control into the hands of the parties and guide where necessary. ","[{'day': 'Monday', 'slots': ['09:00-11:00', '13:00-15:00', '16:00-18:00']}, {'day': 'Tuesday', 'slots': ['10:00-12:00', '14:00-16:00']}, {'day': 'Wednesday', 'slots': ['09:00-11:00', '13:00-15:00']}, {'day': 'Thursday', 'slots': ['10:00-12:00', '14:00-16:00', '17:00-19:00']}, {'day': 'Friday', 'slots': ['09:00-11:00', '12:00-14:00']}]",2024-05-26T09:44:17.445977,2024-05-26T09:44:17.445988
68,Michelle Dhyll,julia27@andrade.com,"Areas of expertise:Construction Dispute Resolution / Contractual Disputes / Landlord & Tenant Disputes / Divorce Dispute Resolution / General Dispute ResolutionCountry of Practice: United KingdomLanguagesEnglish (native), Italian (fluent)","Areas of expertise:Construction Dispute Resolution / Contractual Disputes / Landlord & Tenant Disputes / Divorce Dispute Resolution / General Dispute ResolutionCountry of Practice: United KingdomLanguagesEnglish (native), Italian (fluent)","With 14 years of working in the Construction sector, specialising in Mediation and the Contract Administration of JCT, NEC, Design & Build and Traditional forms of Contracts, Real Estate Disputes and Dispute Resolution in general areas, my expertise combines mediation skills which make for a structured, relaxed and result-based outcome, developed through two-party collaboration and a desire to resolve the issue at hand without the involvement of litigation.The knowledge, experience, and methods gained allow me to guide parties towards a mutually amicable resolution based on information provided by both parties regardless of dispute size.I have trained as a Barrister at the BPP University on the Barristers Training Course and possess the skill of impartial advocacy, which assists me in achieving the best outcome for all parties throughout all civil sectors.","My mediation style contains third-party impartiality, empathy, and a stress-free setting where your perspective will be fully heard, non-judgmentally. I understand and appreciate that the mediation process has followed a time of disagreement between the parties, and during my sessions, I will provide an environment that facilitates an open and honest discussion, which concludes with both parties agreeing to a mutually beneficial resolution. ","[{'day': 'Monday', 'slots': ['09:00-11:00', '13:00-15:00', '16:00-18:00']}, {'day': 'Tuesday', 'slots': ['10:00-12:00', '14:00-16:00']}, {'day': 'Wednesday', 'slots': ['09:00-11:00', '13:00-15:00']}, {'day': 'Thursday', 'slots': ['10:00-12:00', '14:00-16:00', '17:00-19:00']}, {'day': 'Friday', 'slots': ['09:00-11:00', '12:00-14:00']}]",2024-05-26T09:44:17.447095,2024-05-26T09:44:17.447105
69,Moussa Mungur,petersonjesse@yahoo.com,"Civil/Commercial Disputes, Consumer Disputes and ODR specialistLanguagesEnglish, French, Creole",Accredited ADR ODR International Civil/Commercial Mediator ,Upper Second Class Honours in Law from Middlesex University in 2018Bar Professional Training Course (BPTC) in 2019 ,"Being from a multi-cultural country where different languages are spoken every day, having the freedom of speech and to practice my religion freely and in harmony with other religion, I believe this enables me to build trust and rapport with parties as they can relate to these values. Although my demeanor during a will be profession, am very open to new cultures and I can and will be very friendly, flexible and accessible and mostly importantly impartial. Indeed, Mediation can and will be challenging sometimes, physically, mentally, emotionally or psychologically, I believe that effective communication in a neutral but friendly atmosphere, facilitates things and make things move at a faster rate, and hopefully to settle. I am able to accommodate parties on weekends and evenings no matter if the parties are from different places across the globe.","[{'day': 'Monday', 'slots': ['09:00-11:00', '13:00-15:00', '16:00-18:00']}, {'day': 'Tuesday', 'slots': ['10:00-12:00', '14:00-16:00']}, {'day': 'Wednesday', 'slots': ['09:00-11:00', '13:00-15:00']}, {'day': 'Thursday', 'slots': ['10:00-12:00', '14:00-16:00', '17:00-19:00']}, {'day': 'Friday', 'slots': ['09:00-11:00', '12:00-14:00']}]",2024-05-26T09:44:17.448201,2024-05-26T09:44:17.448211
70,Mostafizur Rahman,whitelogan@bernard.com, Civil/Commercial Mediator  Contractual disputes and corporate matters     Country of Practice  Bangladesh  The United Kingdom   Languages  English  Bengali   ,"ADR ODR Accredited Civil/Commercial MediatorADR ODR International2020Online Dispute ResolutionADR ODR International2020Member of The Honourable Society of Lincoln’s Inn 2017Co-founder at Legal Genesis, an organization to build platform for developing oratory skills2015",Associate at Iqbal & Roy 2017Internship at Sattar&Co. 2016Director of Operations at Legal Genesis 2015, I prefer the facilitative approach and my aim is simple. I wish to assist the disputing parties to figure out the opportunity that will break through their disputes.   I wish to create a bridge where participants can come together and share their concerns and views points expressly.    I will create an environment where disputing parties can agree to an offer of settlement which will render mutual benefits for both resulting a better understanding positions and future working relationships amongst themselves. ,"[{'day': 'Monday', 'slots': ['09:00-11:00', '13:00-15:00', '16:00-18:00']}, {'day': 'Tuesday', 'slots': ['10:00-12:00', '14:00-16:00']}, {'day': 'Wednesday', 'slots': ['09:00-11:00', '13:00-15:00']}, {'day': 'Thursday', 'slots': ['10:00-12:00', '14:00-16:00', '17:00-19:00']}, {'day': 'Friday', 'slots': ['09:00-11:00', '12:00-14:00']}]",2024-05-26T09:44:17.450368,2024-05-26T09:44:17.450380
71,Mridula Chooromoney,megan49@yahoo.com,"Commercial Mediator & Arbitrator (Malaysia Institute of Arbitrators)LanguagesEnglish, French, Creole",Which mediation qualifications they have Accredited Commercial Mediator from ADR-ODR International. Year qualified 2017,Intern at I-Contract Solutions May 2014Intern at the Kuala Lumpur Regional Centre for Arbitration- June 2014Kwan & Associates Law Firm 2016- till date.,Listening and paying attention to what the client wants and helping them to reality test is key. Looking at a best win/win situation for both parties . Being focused on bringing a better quality of life for clients such that they feel comfortable and in good & trustworthy hands. Adopting a Principled yet reasonable approach to the issue. Separating the People from the problem is a forte.,"[{'day': 'Monday', 'slots': ['09:00-11:00', '13:00-15:00', '16:00-18:00']}, {'day': 'Tuesday', 'slots': ['10:00-12:00', '14:00-16:00']}, {'day': 'Wednesday', 'slots': ['09:00-11:00', '13:00-15:00']}, {'day': 'Thursday', 'slots': ['10:00-12:00', '14:00-16:00', '17:00-19:00']}, {'day': 'Friday', 'slots': ['09:00-11:00', '12:00-14:00']}]",2024-05-26T09:44:17.451229,2024-05-26T09:44:17.451240
72,Muazu Abdul-mu-umin,stacy49@hotmail.com,"All Civil-Commercial disputes, especially cross boarder or cross cultural Civil-Commercial disputes.LanguagesEnglish, Hausa, Mampruli, Arabic (basic) and Mossi. ",Online Dispute Resolution (2018)ADR ODR International Accredited Civil/Commercial Mediatos Course (2018)ADR ODR International,"Transport and Logistics Specialist D - Her Majesty Armed Forces, UK (2009 - 2014)Sakogu Area Council Chairman Sakogu - Gambia, Ghana (2006 - 2008)LLB (Hons) Anglia Ruskin Univeristy, Cambridge, 2017Managing Director, IBN J Enterprise, Ghana",Muazu utilises the facilitative model of mediation. He is a master at making the right condition for the parties to settle on their own choices without feeling under strain to do as such. His exceptional linguistic and social information furnishes him with the capacity to mediate between parties who may not speak similar dialect or comprehend the same social standards.,"[{'day': 'Monday', 'slots': ['09:00-11:00', '13:00-15:00', '16:00-18:00']}, {'day': 'Tuesday', 'slots': ['10:00-12:00', '14:00-16:00']}, {'day': 'Wednesday', 'slots': ['09:00-11:00', '13:00-15:00']}, {'day': 'Thursday', 'slots': ['10:00-12:00', '14:00-16:00', '17:00-19:00']}, {'day': 'Friday', 'slots': ['09:00-11:00', '12:00-14:00']}]",2024-05-26T09:44:17.452174,2024-05-26T09:44:17.452186
73,Myriam El Kara,kevin27@cobb-khan.com," Profession/s  Head of Supply Chain, Verkor SA, Li-ion battery cell manufacturer   Areas of Expertise  Commercial, general  Commodities trading / Sale of goods  Metals & Mining  Energy  Environment  International Commercial  JV/ Shareholders’ agreements  Finance / Banking / Securities   Qualified arbitrator (Fellow CIArb) since August 2020   Country of Practice   No geographical restriction.   Languages  English, French, Arabic    ","ADR ODR International, SIMI Accredited Civil/Commercial Mediator, February 2020.","General Manager, energy products, Singapore, IndonesiaBusiness Developer, thermal coal, Singapore IndonesiaSenior Risk Management Consultant, banking, London, UKInvestment and Trading Associate, capital markets, Paris, FranceIn-house Counsel, capital markets, Paris, FranceMyriam is a qualified ADR ODR International Accredited Civil and Commercial Mediator and a Fellow of the Chartered Institute ofArbitrators following an intensive training in international arbitration practice, procedure and award writing. She has a dual academic background in law and business and has honed her skills through experience in the Middle East, Europe and Asia, in the industries of banking, finance, and commodities investment and trading. This gives Myriam a sound acumen in identifying issues, a rigorous approach to problem solving, and an analytical yet creative mind informed by market realities, and geographical and cultural specificities. ","A careful listener, Myriam believes in facilitative, pragmatic approach to mediating disputes. Aware that every person and situation is unique, her stylewill adapt to the needs of the parties and the case, while safeguarding process efficiency and an objective-driven focus to reach resolution.","[{'day': 'Monday', 'slots': ['09:00-11:00', '13:00-15:00', '16:00-18:00']}, {'day': 'Tuesday', 'slots': ['10:00-12:00', '14:00-16:00']}, {'day': 'Wednesday', 'slots': ['09:00-11:00', '13:00-15:00']}, {'day': 'Thursday', 'slots': ['10:00-12:00', '14:00-16:00', '17:00-19:00']}, {'day': 'Friday', 'slots': ['09:00-11:00', '12:00-14:00']}]",2024-05-26T09:44:17.453968,2024-05-26T09:44:17.453980
74,Nazma Sayani,monicacombs@gmail.com,"Profession/s Senior Human Resources ProfessionalAreas of expertise Employee Relations, Conflict Resolution, Resolving Complex Interpersonal issuesCountry of Practice United KingdomLanguagesEnglish","Profession/s Senior Human Resources ProfessionalAreas of expertise Employee Relations, Conflict Resolution, Resolving Complex Interpersonal issuesCountry of Practice United KingdomLanguagesEnglish","As a Human Resources professional, my role is to help the organisations provide positive andengaging workplaces by navigating through the overall employee journey. This involvesfostering and promoting a culture which aligns with the company and individual values,implementing procedures and processes to attract and retain top talent, developing strategies toenhance employee engagement and satisfaction. Implementing programs that supportcontinuous learning and development, promoting employee well-being by implementinginitiatives that support work-life balance. My role is also to facilitate effective communicationchannels to ensure employees are well-informed and lead efforts to create diversity, equity andinclusivity. Being in Human Resources also involves acting as a mediator in employee relationsmatters, addressing conflict and ensuring a respectful workplace environment and finallyhandling employees offboarding process with sensitivity and professionalism.","As a senior HR professional turned Mediator, I am committed to helping organisations andindividuals navigate disputes and conflict with efficiency and fairness. I have a genuine desireto understand the root causes of conflict, facilitate open communications and guide partiestowards mutually beneficial resolutions.As an advocate for alternate dispute resolution, I am well versed in mediation techniques,negotiation strategies and conflict de-escalation. Known for my calm demeanor and patience, Ihave the ability to create a safe, confidential and neutral space for open dialogue.","[{'day': 'Monday', 'slots': ['09:00-11:00', '13:00-15:00', '16:00-18:00']}, {'day': 'Tuesday', 'slots': ['10:00-12:00', '14:00-16:00']}, {'day': 'Wednesday', 'slots': ['09:00-11:00', '13:00-15:00']}, {'day': 'Thursday', 'slots': ['10:00-12:00', '14:00-16:00', '17:00-19:00']}, {'day': 'Friday', 'slots': ['09:00-11:00', '12:00-14:00']}]",2024-05-26T09:44:17.455125,2024-05-26T09:44:17.455137
75,Nazneen Malik,patrick14@bridges.com,MediationCoachingTraining – deliver a range of soft skills supporting mediators/non-mediators Trained on On-Line MediationAdministrating and interpreting Myers Briggs and other psychological tools.LanguagesEnglish UrduPunjabi,"Ran my own HR and People & Organisational Development Consultancy securing interim contracts in a very diverse range of Public and Private sector organisations at both strategic and operational level. I delivered Strategy, Policies, trained in a range of soft skills, Coaching directors, board development and administered psychological and personality instruments to enable individuals understand themselves and open up pathways to achieving their life’s goals.Whilst undertaking assignments, I found myself being called upon to help resolve many conflicts, which I found very rewarding.In 2013 I took the decision to leave consulting and focus on becoming a mediator.An officer and one of the founding members of Mediation Awareness Week 2016",Align Mediation 2020,"I am a pragmatic, empathic communicator, skills honed through delivering interim projects in HR/ People and Organisational Development. I use these skills to establish rapport with each party during the initial explorative conversation and within the opening statement of any mediation.Subscribe to a blended style of mediation; encouraging and supporting parties to keep a forward-looking momentum by thinking creatively and extending a collaborative approach to negotiating a settlement. Collaboration helps reduce anxiety, time taken to reach agreement, more chances of leaving mediation with a level of positive ‘relationship’ between partys.Client Feedback“Nazneen’s warm and open yet, firm style of communication, helped us achieve an outcome that did not seem possible at the start of the mediation: we didn’t want to be in the same room at the start, but left shaking hands!”","[{'day': 'Monday', 'slots': ['09:00-11:00', '13:00-15:00', '16:00-18:00']}, {'day': 'Tuesday', 'slots': ['10:00-12:00', '14:00-16:00']}, {'day': 'Wednesday', 'slots': ['09:00-11:00', '13:00-15:00']}, {'day': 'Thursday', 'slots': ['10:00-12:00', '14:00-16:00', '17:00-19:00']}, {'day': 'Friday', 'slots': ['09:00-11:00', '12:00-14:00']}]",2024-05-26T09:44:17.456452,2024-05-26T09:44:17.456465
76,Neha Mishra,gregory72@french.com,"ADR-ODR International accredited Civil-Commercial Mediator, Business MediationLanguagesEnglish, Hindi",Accredited Civil-Commercial Mediator under ADR-ODR International Limited. (Qualified in July 2017)," Student of Law (2015- 2020), at O.P. Jindal Global University, Sonipat, Haryana, India, Clinical Course in Alternate Dispute Resolution, including theoretical and practical background in mediation, concilliation and arbitration, August 2017- November 2017The Bucerius Summer Program in International Business Law at Bucerius Law School Hamburg, Germany, July 2017A Grade awarded in Business Mediation. – Learnt practical skills and theoretical background of professional conflict management and resolution, with a focus on the interest-based method of mediation. Introduction to areas of business conflict management, including the management of workplace conflicts, choice of procedure in inter-business conflicts and the interplay between mediation and arbitration. Learnt to deal with conflicts systematically and constructively.B Grade awarded in International Commercial Arbitration- Learnt about arbitration as a dispute resolution process for international trade and business disputes, giving special attention to the international framework of arbitration, in particular the UNCITRAL Model Law on International Commercial Arbitration as well as the New York Convention.Civil/Commercial Mediation Training, ADR Group, April 2017","I am currently a student of law at O.P. Jindal Global University, in India, (August 2015- August 2020). I have had theoretical and practical exposure to mediation and arbitration through the clinical courses and summer programs I have taken as well as the professional training I received from the ADR- ODR group in April 2017. I will mediate as a neutral third party and try to identify the interests of the parties. I will give utmost importance to party autonomy as I am of the view that settlement by mediation must be capable of fulfilling the party’s interests and not someone else’s conception of what the perfect solution should be. The experience and the training I have had so far has made me capapble as a mediator to navigate through the power dynamics, cognitive biases, conflicting interests of the parties and help the parties to reach an amicable solution. I am trustworthy, hardworking and hopeful in my approach of mediating.","[{'day': 'Monday', 'slots': ['09:00-11:00', '13:00-15:00', '16:00-18:00']}, {'day': 'Tuesday', 'slots': ['10:00-12:00', '14:00-16:00']}, {'day': 'Wednesday', 'slots': ['09:00-11:00', '13:00-15:00']}, {'day': 'Thursday', 'slots': ['10:00-12:00', '14:00-16:00', '17:00-19:00']}, {'day': 'Friday', 'slots': ['09:00-11:00', '12:00-14:00']}]",2024-05-26T09:44:17.458330,2024-05-26T09:44:17.458342
77,Dr Neil Shastri-Hurst,conradamanda@garcia-perez.com,"Barrister and Mediator, No5 Chambers, specializing in Clinical Negligence, Personal Injury, Coronial Law, and Healthcare Regulatory Law (2018 to date)Medical Tribunal Member, Medical Practitioners Tribunal Service (2016 to date)NHS Surgeon (2011-2018)British Army Medical Officer (2006-2014)",Areas of expertise Personal Injury and Clinical NegligenceCountry of Practice UKLanguagesEnglish,"Barrister and Mediator, No5 Chambers, specializing in Clinical Negligence, Personal Injury, Coronial Law, and Healthcare Regulatory Law (2018 to date)Medical Tribunal Member, Medical Practitioners Tribunal Service (2016 to date)NHS Surgeon (2011-2018)British Army Medical Officer (2006-2014)","Neil’s military experiences have enabled him to develop a pragmatic and innovative approach to problem solving. He takes a collaborative approach to mediation, seeking to establish a good rapport between himself and the parties. By doing so, he is able to build a sound basis from which to move the mediation process forwards.","[{'day': 'Monday', 'slots': ['09:00-11:00', '13:00-15:00', '16:00-18:00']}, {'day': 'Tuesday', 'slots': ['10:00-12:00', '14:00-16:00']}, {'day': 'Wednesday', 'slots': ['09:00-11:00', '13:00-15:00']}, {'day': 'Thursday', 'slots': ['10:00-12:00', '14:00-16:00', '17:00-19:00']}, {'day': 'Friday', 'slots': ['09:00-11:00', '12:00-14:00']}]",2024-05-26T09:44:17.460081,2024-05-26T09:44:17.460093
