id,name,contact_info,expertise,membership,experience,style_approach,availability,created_at,updated_at
183,Stephen Wood,higginsdoris@hotmail.com,Profession/s Solicitor and MediatorAreas of expertise  Business Disputes Commercial Contracts Partnership Disputes Shareholder Disputes Professional Negligence Employment Disputes Boundary Disputes Contentious Probate Disputes Proprietary Estoppel Landlord and Tenant Consumer Disputes Workplace DisputesCountry of Practice UKLanguagesEnglish,Profession/s Solicitor and MediatorAreas of expertise  Business Disputes Commercial Contracts Partnership Disputes Shareholder Disputes Professional Negligence Employment Disputes Boundary Disputes Contentious Probate Disputes Proprietary Estoppel Landlord and Tenant Consumer Disputes Workplace DisputesCountry of Practice UKLanguagesEnglish,"Stephen is a flexible, experienced and enthusiastic Civil & Commercial Mediator and a Workplace Mediator, and has undertaken over 95 paid mediations. Stephen was called as a Barrister (by Gray’s Inn) in 1998 and admitted as a Solicitor in 2002. Stephen is a non-practising Barrister. Stephen practises as a Consultant Dispute Resolution Solicitor in Northampton and was previously a partner and head of litigation in a multi-office firm of solicitors in Northamptonshire. Stephen has experience of commercial, contractual, professional negligence, contentious probate, employment, boundary disputes, property and personal injury claims, and has represented clients as a mediation advocate in a variety of mediations. In 2017 Stephen was appointed to the Panel of Chairs of the Valuation Tribunal for England, and regularly hears appeals concerning Council Tax and Non-Domestic Rates. In 2023 Stephen was appointed as a Magistrate in the Family Court. Stephen was a judge at the ADR ODR International Online Mediation Competition in 2020. In 2023, 2020 and 2019 Stephen was a judge at the ICC International Commercial Mediation Competition in Paris. In 2022 and 2021 Stephen was a judge at the ICC International Online Mediation Competition. Stephen has also been a judge at the INADR International Law School Mediation Competitions in Bologna (in 2023), in Glasgow (in 2017), in Athens (in 2016) and in London (in 2015). In 2020 Stephen studied negotiation with Yale’s School of Management and also with MIT. In 2017 Stephen studied at Harvard Law School’s Program on Negotiation. Stephen has studied management courses with London Business School (in 2020) and Birkbeck College (in 2020).","Stephen is an experienced litigation Solicitor and Company Director and is able to deal effectively with a broad range of mediations. He has worked in dispute resolution for over 23 years, and combines sound commercial acumen with creative thinking and strong analytical skills. A good listener and an empathetic mediator, Stephen is alert to the personal and emotional issues which often need to be overcome to facilitate a successful long-term resolution to a dispute.","[{'day': 'Monday', 'slots': ['09:00-11:00', '13:00-15:00', '16:00-18:00']}, {'day': 'Tuesday', 'slots': ['10:00-12:00', '14:00-16:00']}, {'day': 'Wednesday', 'slots': ['09:00-11:00', '13:00-15:00']}, {'day': 'Thursday', 'slots': ['10:00-12:00', '14:00-16:00', '17:00-19:00']}, {'day': 'Friday', 'slots': ['09:00-11:00', '12:00-14:00']}]",2024-05-26T09:44:17.465502,2024-05-26T09:44:17.465510
184,Sultan Mohamed,elizabethwalker@yahoo.com,Civil- Commercial MediationFamily MediationCommercial ArbitrationLanguagesEnglish,"I qualified as a Chartered Accountant in 1976. I am a Fellow of the Institute of Chartered Accountants and a Fellow of The Association of Chartered Certified Accountants.In 1983, I became an Associate member of the Chartered Institute of Arbitrators. Between 2007 and 2012, I was a member of the National Conciliation and Arbitration Board in the UK.","Born in Uganda, I came to the UK in 1970 and qualified as a Chartered Accountant in 1976. Presently, I provide advice to clients from a range of industries such as a Sports and Classic car company that operates across UK and Europe.In 1983, I became an Associate member of the Chartered Institute of Arbitrators. Between 2007 and 2012, I was a member of the National Conciliation and Arbitration Board in the UK, specifically focusing on family and commercial mediation within the Ismaili community in the UK and Europe. Most recently, I have focused specifically on family and commercial cases, completing three Commercial Mediation cases which involved assets of between £4.5M and £22M in the last two years.","As a mediator, be it commercial or family, I have built a reputation for being conscientious, sensitive and patient in all situations, with a dedication to work with parties until the very end and encourage them to reach a resolution. I am logical, determined and resolute in my approach, whilst also being engaging and constructive which helps more difficult parties to move quickly towards resolution and get to the bottom of any issue.With my background in finance, management and accounting, I have the knowledge to deal with complex financial matters and quickly work out and react to the financial side effects of any outcome being discussed. With all potential clients, I am always happy to hold preliminary telephone discussions with potential clients without any obligation.To get the best outcome for my clients, I am a keen believer of giving the parties the option to go down the Med-Arb route. These agreements allow parties to combine the benefits of two ADR processes and as a result, guarantee that a final and binding award will be issued in the event that a settlement is not achieved in mediation.","[{'day': 'Monday', 'slots': ['09:00-11:00', '13:00-15:00', '16:00-18:00']}, {'day': 'Tuesday', 'slots': ['10:00-12:00', '14:00-16:00']}, {'day': 'Wednesday', 'slots': ['09:00-11:00', '13:00-15:00']}, {'day': 'Thursday', 'slots': ['10:00-12:00', '14:00-16:00', '17:00-19:00']}, {'day': 'Friday', 'slots': ['09:00-11:00', '12:00-14:00']}]",2024-05-26T09:44:17.466044,2024-05-26T09:44:17.466050
185,Sushruti Tripathi,schroedercarmen@king-flores.net,"Legal expertise in climate change, energy and environment, contracts and commercial law.Mediation expertise: contractual disputes; family disputes; peer-to-peer mediation at school, universities and with young adults.LanguagesEnglish, Hindi.I can also understand basic Bengali.","Civil and Commercial Mediator (ADR Group, London 2013)Advocate with the Bar Council of India (since 2016)","Founder Director, Centre for Poetry and Conflict Resolution, ADR ODR International Ltd, London (2016 – present)Guest Faculty (Climate Change), West Bengal National University of Juridical Sciences, Kolkata, India (2020-21) Graduate Solicitor at Herbert Smith Freehills, London (2017-2019)Jijivisha Fellow, New Delhi, India (2016-2017) – worked with underprivileged students – teaching them creative expression to build socio-emotional skills including creativity, communication, collaboration, critical thinking, self-esteem and empathy.Teacher, Mentor and Public Relations at Make A Difference, Kolkata, India (2012-2014)AcademicLL.M. (Environment Law, Energy and Climate Change) – Jindal Global Law School, India & Center for Environmental Learning, World Wide Fund for Nature (WWF), India (2020-21)BA - LLB (Honours) – WB National University of Juridical Sciences (NUJS), Kolkata, India (2011-2016)"," I believe that mediation is not just about the issues on the table but the human emotions behind them. What I bring to the mediation is the ability to help parties discover the human aspect to their problems with both an individual and collective understanding to reach better solutions for the long term.  Through empathetic listening skills I prefer to establish a relationship of trust with the parties and spend some time in the rapport-building exercise so that communication becomes smoother and more transparent.  I am willing to bring creative processes into the mediation, such as using poetry as a tool for effective mediation, to help this communication and understanding between parties to enable them to preserve their relationships as well as safeguard their interests.  Having worked for over three years with children to build socio-emotional skills through creative expression and poetry therapy, I particularly emphasize on the suitability of mediation for peer-to-peer conflict resolution in schools and amongst young adults.   ","[{'day': 'Monday', 'slots': ['09:00-11:00', '13:00-15:00', '16:00-18:00']}, {'day': 'Tuesday', 'slots': ['10:00-12:00', '14:00-16:00']}, {'day': 'Wednesday', 'slots': ['09:00-11:00', '13:00-15:00']}, {'day': 'Thursday', 'slots': ['10:00-12:00', '14:00-16:00', '17:00-19:00']}, {'day': 'Friday', 'slots': ['09:00-11:00', '12:00-14:00']}]",2024-05-26T09:44:17.467130,2024-05-26T09:44:17.467141
186,Syed Akbar Hussain,deborahbrown@munoz-patterson.com,"Power & Energy Disputes; Civil-Commercial Disputes, Workplace Disputes; Construction DisputesProfessionAdvocate, High Courts of PakistanLocal Expert, World Bank GroupCEO, International Arbitration Center PakistanSecretary, Human Rights Society of PakistanCountry of Practice Pakistan and TurkeyLanguagesEnglish, Urdu","Advocate, Lower Courts of Pakistan, 2013Advocate, High Courts of Pakistan, 2016Associate, Chartered Institute of Arbitrators, 2017Negotiator, ADR-ODR International, 2017Mediator, ADR-ODR International, 2019","Partner, SAZH Consulting LLPPartner, The ADR Initiative LLPFormer Legal Expert, UNFPAFormer Advisor, Federal Ombudsperson for Workplace HarassmentNominated & Shortlisted – National Mediation Awards","For me, Mediation is the skill of allowing two or more parties the opportunity to translate their intentions and concerns through an impartial Mediator who can then reduce the tension and misdirection accumulated over a possible hostile process. He must then see the common interests and try to guide the parties to what their original interest in a transaction was, and if it has changed then help them discover synergies with it. Therein, I would categorize my style as very accommodating and collaborative with the specific purpose of sustaining the relationship that may have brought these parties together in the first place. It’s a puzzle that needs to be solved, and it’s a brilliant moment when the pieces can come together.","[{'day': 'Monday', 'slots': ['09:00-11:00', '13:00-15:00', '16:00-18:00']}, {'day': 'Tuesday', 'slots': ['10:00-12:00', '14:00-16:00']}, {'day': 'Wednesday', 'slots': ['09:00-11:00', '13:00-15:00']}, {'day': 'Thursday', 'slots': ['10:00-12:00', '14:00-16:00', '17:00-19:00']}, {'day': 'Friday', 'slots': ['09:00-11:00', '12:00-14:00']}]",2024-05-26T09:44:17.469278,2024-05-26T09:44:17.469288
187,Thenmozhi Sivakumar,jonathanschmitt@young.com,"Civil, Commercial, Contractual and Family disputesLanguagesEnglish, and TamilConversational HindiRead French.","Court annexed mediator with Madras High Court since January 2020Lawyer – Independent practice in Intellectual property disputes, contractual disputes and indirect taxation since 1996 till dateSenior Consultant at Ernst & Young LLP from November 2015 to October 2016","Court annexed mediator with Madras High Court since January 2020Lawyer – Independent practice in Intellectual property disputes, contractual disputes and indirect taxation since 1996 till dateSenior Consultant at Ernst & Young LLP from November 2015 to October 2016",I am a non-judgmental and unbiased listener. I hope to bring my active listening skills to the table to make the parties feel understood and heard.  I use facilitative coupled with transformative style in mediation as I believe mediation heals and brings closure to the parties even if a settlement is not reached. I am empathetic and collaborative and at the same having vast experience as a practising lawyer would be able to play devil’s advocate when the situation requires. I would work beyond the disputes at hand to identify the core of the conflict to bring resolution to the parties.,"[{'day': 'Monday', 'slots': ['09:00-11:00', '13:00-15:00', '16:00-18:00']}, {'day': 'Tuesday', 'slots': ['10:00-12:00', '14:00-16:00']}, {'day': 'Wednesday', 'slots': ['09:00-11:00', '13:00-15:00']}, {'day': 'Thursday', 'slots': ['10:00-12:00', '14:00-16:00', '17:00-19:00']}, {'day': 'Friday', 'slots': ['09:00-11:00', '12:00-14:00']}]",2024-05-26T09:44:17.470525,2024-05-26T09:44:17.470533
188,Toks Hussain,jimenezalexandra@davis.com,"Civil; Commercial; International Disputes; NegotiationLanguagesEnglish, French",The Honourable Society of Lincoln’s InnADR-ODR International accredited Civil-Commercial Mediator June 2017Centre for Effective Dispute ResolutionChartered Institute of ArbitratorsInternational Council for Commercial ArbitrationLondon Court of International Arbitration: Young International Arbitration GroupAfrican Commercial Law FoundationBritish Nigerian Law Forum," Centre for Effective Dispute Resolution (CEDR): Adjudicator (Aviation Disputes Panel) Path of Law Group: Founding Partner of legal-technology pro bono group assisting litigants-in-person (previously worked with The Royal Courts of Justice) Brick Court Chambers: Pupil Mediator 3 Paper Buildings: Mini Pupil Barrister Royal Borough of Greenwich: Governor Thomson Reuters: Legal Editor Thomson Reuters Foundation: Awarded ‘Effective Communication Skills for Influencers’ Outside of mediation, I am an international oracy and speech writing coach and have worked with organisations, including the House of Lords, Barclays and Facebook","I am considered to be a skilled diplomat and tactician. I draw on my international experience for example being involved in counter-terrorism initiatives. On a personal level, being Polish-born (and of African origin) and having lived in several countries, that leaves me able to easily relate with diverse cultures or other backgrounds.I like to engage on a human and personal level, but at the same time I bear in mind the commercial and/or personal stakes involved. I can be firm but fair when necessary and above all, I am a peacemaker.","[{'day': 'Monday', 'slots': ['09:00-11:00', '13:00-15:00', '16:00-18:00']}, {'day': 'Tuesday', 'slots': ['10:00-12:00', '14:00-16:00']}, {'day': 'Wednesday', 'slots': ['09:00-11:00', '13:00-15:00']}, {'day': 'Thursday', 'slots': ['10:00-12:00', '14:00-16:00', '17:00-19:00']}, {'day': 'Friday', 'slots': ['09:00-11:00', '12:00-14:00']}]",2024-05-26T09:44:17.471399,2024-05-26T09:44:17.471410
189,Valeria de Sousa Pinto,davidvaldez@yahoo.com,Civil-Commercial Mediation; Online Dispute Resolution; Family and Divorce Mediation  Country of Practice  Brazil   Languages  Portuguese and English , IMAB - Brazilian Mediation and Arbitration Institute/2016. MLC – Straus Institute for Dispute Resolution- Pepperdine University/2017.  ICFML – Institute for Accreditation of Portuguese Language Speaker Mediators/2018. ODR EU Accredited eMediator/2020. ,"Founder and Chief Executive – Mediar|PR training and consulting – Curitiba/BrazilPracticing lawyer in commercial law and family business and divorce.Accredited Mediator for Civil, Commercial and Family-Divorce disputes.Vice-president of the Mediation and Arbitration Chamber at the BAR Association in Parana/Brazil.President of the Mediation Board for the BAR Association in Parana-Brazil/2019-2021.ADR ODR International Civil/Commercial Mediation/2020. Online Dispute Resolution/2020. ","Combining years of consensual advocacy, since 2015 I’ve been focusing my practice on Mediation.  I seek to create a neutral and trustful environment, in order to guarantee confidentiality and impartiality and  give the parties a secure and credible process in order to build a significant and meaningful agreement.  ","[{'day': 'Monday', 'slots': ['09:00-11:00', '13:00-15:00', '16:00-18:00']}, {'day': 'Tuesday', 'slots': ['10:00-12:00', '14:00-16:00']}, {'day': 'Wednesday', 'slots': ['09:00-11:00', '13:00-15:00']}, {'day': 'Thursday', 'slots': ['10:00-12:00', '14:00-16:00', '17:00-19:00']}, {'day': 'Friday', 'slots': ['09:00-11:00', '12:00-14:00']}]",2024-05-26T09:44:17.472976,2024-05-26T09:44:17.472984
190,Weronika Skowronska,jonathanmiller@jimenez.com,"Civil/Commercial, Cross-Cultural and Online Mediations and Negotiations LanguagesPolish (native/bilingual proficiency)English (native/bilingual proficiency)Spanish (professional working proficiency) Chinese Mandarin , ?????? (HSK Level 4)",The Honourable Society of Middle Temple The Society of Construction Law (Academic Membership) CIArb Student Membership - until October 2021 International Bar Association (Membership No. 1518070) ,"Academic Qualification LLM Legal Practice (Barristers) incorporating Bar Professional Training Course and Negotiation and Case Analysis at BPP University BA (Hons) Law with Year Abroad (incorporating Spanish language) at University of Liverpool Chinese Mandarin Language at South China University of Technology ??????, Guangzhou, ChinaProfessional Qualification Chief Operating Officer at ADR ODR International Andalusia Administrator at the British Chamber of Commerce in Spain Legal Assistant at My Lawyer in Spain Lawyers & Solicitors SLP, Marbella, Spain English Language Teacher at Only International Language School, Guangzhou, China ","“Creating Unity, Amidst Diversity” – I first came across this phrase at fifteen when I was appointed a Youth Ambassador for Northern Ireland in the USA at the Ulster Project, a cross-cultural program designed to build relationships between Protestants and Catholics in Northern Ireland. The project was created in response to the historical conflict between the two religious groups with the aim to bridge their divide by inviting dialogue about their differences and building relationships. That is when I started to develop what is now my passion for dispute resolution outside of court. I strongly believe in the benefits of collaborative negotiation, engaging in mediation and other ADR processes, which involve a better use of resources by de-escalating tension between the parties to explore a workable and mutually beneficial solution to their conflict. I am warm and collected with strong interpersonal skills and ability to create empathy in person and online, which allows the parties to feel relaxed and cooperative. I appreciate the importance of understanding different personalities and to avoid a one-size-fits-all approach to negotiation in the mediation process. I believe that the role of a mediator is much more than that of a messenger between the aggrieved parties. Instead, it involves the need for a pragmatic understanding of what is needed by the parties in an often very difficult and emotive process, to engage with and where appropriate, to challenge the parties to assist them with reaching the right agreement and not just any agreement. MOTTO: “The word impossible does not exist in my dictionary but if I ever do come across it, it only means that I haven’t found the solution yet.” ","[{'day': 'Monday', 'slots': ['09:00-11:00', '13:00-15:00', '16:00-18:00']}, {'day': 'Tuesday', 'slots': ['10:00-12:00', '14:00-16:00']}, {'day': 'Wednesday', 'slots': ['09:00-11:00', '13:00-15:00']}, {'day': 'Thursday', 'slots': ['10:00-12:00', '14:00-16:00', '17:00-19:00']}, {'day': 'Friday', 'slots': ['09:00-11:00', '12:00-14:00']}]",2024-05-26T09:44:17.474296,2024-05-26T09:44:17.474308
191,Winsom Gordon,josephdiaz@nash.com,Professional Indemnity Claims with specialist experience of claims against Solicitors. Insurance Policy and CoverageSolicitor risk management and claims avoidancePrimary/Secondary School Admissions AppealsLanguagesEnglish,ADR QualificationsADR Group Civil and Commercial Accredited Mediator:  2005 and 2016Chartered Institute of Arbitrators Associate Examination: 2002Professional MembershipsLaw SocietyCurrent Solicitor’s Practising Certificate/SRAADR-ODR International PanelCMC,"I have over twenty years specialist experience of investigating, advising on and settling professional indemnity claims against solicitors. I spent 15 years at the Solicitors Indemnity Fund as a Solicitor Claims Handler between 1990 and 2005 advising upon claims across the spectrum of the solicitors practice including; residential and commercial transactions, personal injury and medical negligence, landlord and tenant, matrimonial and financial disputes, wills and probate, civil and commercial litigation. I also provided advice and guidance to the solicitors’ profession on risk and claims avoidance and was involved in the structuring and presentation of a nationwide program of risk management seminars for solicitors.The Fund was at the forefront of mediating claims brought against solicitors and I represented the Fund at a great number of mediations.As a Senior Claims Advisor at Victor O Schinnerer & Co ( Underwriter) between 2006 and 2007, I advised on claims against construction and design professionals, architects, engineers, solicitors and accountants. I also advised on insurance, policy and coverage issues.I again specialized in advising and settling claims against solicitors when employed at Fishburns/DWF LLP as a Solicitor Senior Claims Handler between 2010 and 2015. I represented the Insurer client at various mediations including multi party mediations.On qualification as a solicitor my practice included matrimonial and financial disputes, personal injury claims, civil and commercial disputes, liquor licensing applications and advocacy in the Magistrates, County and High Court.I currently sit as an experienced education panel member volunteer on a School Admissions Appeal Panel in North Kent. I was previously the Chair of Governors at an Infant School.",I am told that I have a wonderful tone when communicating with parties and that I am engaging and genuine. I am flexible and approachable and want to put the parties at ease whilst focusing on resolution of the problems. I am keen to bring to the forefront of the parties’ minds the commercial realities of a prolonged dispute and the need to achieve early settlement.,"[{'day': 'Monday', 'slots': ['09:00-11:00', '13:00-15:00', '16:00-18:00']}, {'day': 'Tuesday', 'slots': ['10:00-12:00', '14:00-16:00']}, {'day': 'Wednesday', 'slots': ['09:00-11:00', '13:00-15:00']}, {'day': 'Thursday', 'slots': ['10:00-12:00', '14:00-16:00', '17:00-19:00']}, {'day': 'Friday', 'slots': ['09:00-11:00', '12:00-14:00']}]",2024-05-26T09:44:17.476134,2024-05-26T09:44:17.476146
192,Wynanda W. Coetzee,meganhuff@yahoo.com,Public Prosecutor criminal mediation attended on behalf of accused people. State Attorney informal mediation and negotiation on behalf of State Institutions. Practicing attorney at Geyser and Coetzee Attorneys- since 1994  Formal and informal mediation Negotiations regarding settlement of civil disputes Negotiation on contract drafting and resolution of contract disputes Negotiations with prosecution ,"Profession/s Practicing Attorney (since 1990), Conveyancer and Qualified Mediator (Local and International as well as ODR) and Qualified Arbitrator, ODR specialist Areas of expertise Commercial and contractual disputes mediation (International and ODR) and arbitration (Qualified) Civil and Labour practitioner and mediator Estate law practitioner as well as Property law practitioner and mediator. Family law practitioner (since 1994) and mediator. Country of Practice  South Africa and International ODR Languages Fluent and practicing in both English and Afrikaans ",Public Prosecutor criminal mediation attended on behalf of accused people. State Attorney informal mediation and negotiation on behalf of State Institutions. Practicing attorney at Geyser and Coetzee Attorneys- since 1994  Formal and informal mediation Negotiations regarding settlement of civil disputes Negotiation on contract drafting and resolution of contract disputes Negotiations with prosecution ,"Every dispute has a solution, and my passion is to help parties reach an amicable solution where nobody actually gets 100% but nobody leaves empty handed either, but mutually come to a workable solution negotiated by themselves for themselves. There is enough hostility and acrimonious and if the parties can safe emotional turmoil and financial costs, it is in the interest of all parties. Once Parties are guided to believe that nobody is completely right, they will realise that nobody is completely wrong either. Litigation should always be the last option. ","[{'day': 'Monday', 'slots': ['09:00-11:00', '13:00-15:00', '16:00-18:00']}, {'day': 'Tuesday', 'slots': ['10:00-12:00', '14:00-16:00']}, {'day': 'Wednesday', 'slots': ['09:00-11:00', '13:00-15:00']}, {'day': 'Thursday', 'slots': ['10:00-12:00', '14:00-16:00', '17:00-19:00']}, {'day': 'Friday', 'slots': ['09:00-11:00', '12:00-14:00']}]",2024-05-26T09:44:17.477242,2024-05-26T09:44:17.477253
