id,name,contact_info,expertise,membership,experience,style_approach,availability,created_at,updated_at
124,Anne-Kristin Treiber,monicacombs@gmail.com,"Civil-commercial mediationPolitical mediationLanguagesEnglish, French, German",Civil-commercial mediatorADR-ODR International mediation panel membership since December 2016Member of the CMC since January 2017.Member of the United Nations mediation expert roster at the UN Department for Political Affairs since 2010.,"Political mediation – (highlights)I have extensive experience in the area of political mediation and conflict resolution working with the United Nations and Governments in the Middle East, Africa and the UK.I have served on the UN’s Standby Team of Mediation Experts in 2010, providing mediation advice to UN Special Representatives, UN Country Teams in West Africa and Asia and policy teams.From 2011-12, I was appointed Peace and Development Adviser to the UN’s Resident and Humanitarian Coordinator in Chad by the UN Department of Political Affairs and the United Nations Development Programme. Accomplishments include the establishment of the inter-Chadian network of mediators, an initiative funded jointly by the European Union and UNDP and extensive work on a political dialogue committee.Since 2013, I have advised Governments. As a Senior Policy adviser for the UK Government, I have provided mediation and conflict resolution advice to numerous political processes with a focus on the Middle East.I currently hold the position of Senior Policy Adviser to the German Foreign Office where, among other things, I provide support to the Government's mediation team.","Having worked internationally most of my career, including in many conflict contexts, I bring a nuanced understanding of different cultures, their communication and negotiation styles as well as the larger political context parties operate in. I combine strong analytical and communication skills with the ability to empathise and think outside the box to find creative solutions.","[{'day': 'Monday', 'slots': ['09:00-11:00', '13:00-15:00', '16:00-18:00']}, {'day': 'Tuesday', 'slots': ['10:00-12:00', '14:00-16:00']}, {'day': 'Wednesday', 'slots': ['09:00-11:00', '13:00-15:00']}, {'day': 'Thursday', 'slots': ['10:00-12:00', '14:00-16:00', '17:00-19:00']}, {'day': 'Friday', 'slots': ['09:00-11:00', '12:00-14:00']}]",2024-05-26T09:44:17.455125,2024-05-26T09:44:17.455137
125,Anthony Kennedy,patrick14@bridges.com,"I have, by advising on contractual and commercial disputes in the recent past, gained experience of those subject areas. Indeed, having previously belonged to a set of chambers specialising in commercial chancery work, I am au fait with both high powered commercial contractual disputes and basic contractual disputes and legal wrangling over the validity of wills/letters of probate.I also have wide-ranging subject knowledge of disputes which have a European and African cross-border element to them (I am Module Leader for Commercial Dispute Resolution at my present institution and have co-authored a book – publication of which is expected in January 2018 – about private international law in Anglophone African jurisdictions).LanguagesEnglish","I have, since mid-2017, been an ADR-ODR International Limited Accredited mediator.","As noted above, I acquired experience of mediation while at Serle Court chambers (which I have now left, though would like to rejoin as an academic associate tenant). Currently, I am in charge of the Resolution of Disputes Out of Court module on the Bar Professional Training Course at BPP Law School, which means that I have oversight of the way in which we teach, inter alia, arbitration, mediation and negotiation.","In my view, the costs which parties will inevitably accrue if they decide to have the dispute between them determined by a judge at trial are astronomically high. Accordingly, where parties wish to use mediation, I believe that they should be given a high quality service, where I ensure, through frank dialogue, that they have thought truly about the legal and pragmatic consequences of taking their dispute all the way to its conclusion. In short, therefore, I offer fair and practical help to parties to find common ground and a solution which both can accept, with a view to getting on with their lives free of conflict in the immediate future.","[{'day': 'Monday', 'slots': ['09:00-11:00', '13:00-15:00', '16:00-18:00']}, {'day': 'Tuesday', 'slots': ['10:00-12:00', '14:00-16:00']}, {'day': 'Wednesday', 'slots': ['09:00-11:00', '13:00-15:00']}, {'day': 'Thursday', 'slots': ['10:00-12:00', '14:00-16:00', '17:00-19:00']}, {'day': 'Friday', 'slots': ['09:00-11:00', '12:00-14:00']}]",2024-05-26T09:44:17.456452,2024-05-26T09:44:17.456465
126,Areesha Amin,gregory72@french.com,"Civil and Commercial MediationLanguagesEnglish, Urdu, Punjabi, Hindi",ADR-ODR International accredited Civil-Commercial Mediator- trained by ADR-ODR International in 2017,"Sep 2017 – to date – Mowbray Woodwards Solicitors, Bath – ParalegalMay 2016 – Sep 2017 – Royal United Hospitals NHS Foundation Bath – Project Support OfficerSeptember 2014 – May 2016 – Loss Management Group, Bath – Claims HandlerAccreditation and QualificationCommercial Mediator ADR International ADR- ODR InternationalLPC Advance legal Practice – The University of West of England Bristol 2016 – 2017Legal Secretary Diploma – Institute of legal Secretaries and PA’s London 2015 – 2016LLB (Hons) The University of West of England Bristol 2013 – 2016",Highly focused on the quality of the mediation process whilst trying to achieve mutually satisfactory resolution for both parties. I understand the importance of listening and have a clam and supportive inter-personal style which enables me help break deadlocks between the parties. I encourage parties to focus on conflict free future and leave the blame behind.,"[{'day': 'Monday', 'slots': ['09:00-11:00', '13:00-15:00', '16:00-18:00']}, {'day': 'Tuesday', 'slots': ['10:00-12:00', '14:00-16:00']}, {'day': 'Wednesday', 'slots': ['09:00-11:00', '13:00-15:00']}, {'day': 'Thursday', 'slots': ['10:00-12:00', '14:00-16:00', '17:00-19:00']}, {'day': 'Friday', 'slots': ['09:00-11:00', '12:00-14:00']}]",2024-05-26T09:44:17.458330,2024-05-26T09:44:17.458342
127,Arjun Chawla,conradamanda@garcia-perez.com,"Family Disputes , Company Matters , Investors DisputesContract and Tenders , Service MattersLanguagesRead , Write and SpeakEnglish, Hindi , PunjabiRead and SpeakGujaratiSpeakUrdu",Accredited MediatorLondon School Of MediationBar Council of Delhi,Advocate since 2001Mediator since 2014Banking 25 years,"Persuasive , Transparent Mediation is process of creating bridge of faith between two parties opposing yet willing to meet . Both have aspirations ,egos and fears . Mediator with his persuasive skill has to win faith of both . Both know settlement is best option still have reservation . Mediator has to generate and win confidence of both and guide warring parties to solution ,where both come out to be winner .  He has to be transparent , knowledgeable and good human being capable of dressing the egos without hurting anyone. ","[{'day': 'Monday', 'slots': ['09:00-11:00', '13:00-15:00', '16:00-18:00']}, {'day': 'Tuesday', 'slots': ['10:00-12:00', '14:00-16:00']}, {'day': 'Wednesday', 'slots': ['09:00-11:00', '13:00-15:00']}, {'day': 'Thursday', 'slots': ['10:00-12:00', '14:00-16:00', '17:00-19:00']}, {'day': 'Friday', 'slots': ['09:00-11:00', '12:00-14:00']}]",2024-05-26T09:44:17.460081,2024-05-26T09:44:17.460093
128,Arooj Sheikh,ethan26@powell-taylor.com,"Commercial DisputesLanguagesEnglish, Urdu, Hindi, Punjabi, Swahili",Member of the Inner Temple – 2017ADR-ODR Civil Commercial Mediator - 2018,"Arooj is an Associate at JMiles & Co, specialising in International Arbitration, Fraud Investigation, Asset Chasing and Mediation. She was recently Called to the Bar of England and Wales by the Inner Temple, after studying Law in Malaysia and the United Kingdom. She is the Country Lead for Kenya for ADR-ODR International, and an Ambassador for the Africa Prisons Project, a Project aiming to restore hope and dignity to inmates across prisons in Africa.",Arooj draws on her own diverse background and personal experiences to appreciate and understand cultural issues which often play a key role in the cause of disputes. She provides an empathetic and non-judgmental forum for parties to explore avenues for settlement. ,"[{'day': 'Monday', 'slots': ['09:00-11:00', '13:00-15:00', '16:00-18:00']}, {'day': 'Tuesday', 'slots': ['10:00-12:00', '14:00-16:00']}, {'day': 'Wednesday', 'slots': ['09:00-11:00', '13:00-15:00']}, {'day': 'Thursday', 'slots': ['10:00-12:00', '14:00-16:00', '17:00-19:00']}, {'day': 'Friday', 'slots': ['09:00-11:00', '12:00-14:00']}]",2024-05-26T09:44:17.461458,2024-05-26T09:44:17.461469
129,Bhupendra Khetia,michaelsteele@henson.info," Accredited in International and Civil Mediation  International and Commercial Dispute Resolution  Deals with all kinds of Property Disputes including Landlord and Tenant and   Consumer Disputes and Debt Recovery matters.     Country of Practice   United Kingdom   Languages  English, Gujarati, and Hindi    ",Member of the Law Society of England and Wales and a Qualified Solicitor since 1999.Accredited International and Civil Mediator Accredited in International and Commercial Dispute ResolutionInternational Mediation Institute Qualified Mediator,One of the Founding Directors at Premier Solicitors in Bedford since 2006The Management Committee for a Charity Organisation since 2008," I am always independent in my thinking and always try to find a solution to a problem which both parties would be satisfied with. I am meticulous towards the details and always objective in the crux of the issues of the specific matter. I assist by bringing an amicable solution by listening, aiding and bringing out the vital issues of the matter and then finding a resolution in a fair and concise manner for all the parties. I am a warm, friendly and a very approachable person who tries to bring a clear realistic and workable solution which will work for both parties. ","[{'day': 'Monday', 'slots': ['09:00-11:00', '13:00-15:00', '16:00-18:00']}, {'day': 'Tuesday', 'slots': ['10:00-12:00', '14:00-16:00']}, {'day': 'Wednesday', 'slots': ['09:00-11:00', '13:00-15:00']}, {'day': 'Thursday', 'slots': ['10:00-12:00', '14:00-16:00', '17:00-19:00']}, {'day': 'Friday', 'slots': ['09:00-11:00', '12:00-14:00']}]",2024-05-26T09:44:17.462964,2024-05-26T09:44:17.462973
130,Catherine Shephard,amanda43@hotmail.com,Civil and commercial disputesConflict resolutionLanguagesEnglish,ADR-ODR International accredited Civil-Commercial Mediator (2017)Solicitor (non-practising) (1999)Licensed Practitioner of Neuro-Linguistic Programming (2017)Fellow of the Higher Education Academy (2007),"MA (Law), BA (Law), University of Cambridge (2000,1996)Solicitor, Corporate Finance, Addleshaw Goddard (1997-2003)Author, Legal Systems and Skills (3rd edn, Oxford University Press 2017)PGCE(HE), University of Liverpool (2007)Senior Lecturer, Manchester Metropolitan University (2012-date)Senior Lecturer, The University of Law (2003-2012)","I enjoy working with people to help them achieve their goals and celebrate their successes. I believe that most people are doing their best, in the circumstances, and that mediation is a genuine opportunity for you to change those circumstances to achieve a better outcome for you.My academic record is excellent and I have twenty years’ of valuable and successful experience in professionally training and advising both individuals and businesses so they can flourish. Everyone deserves to have a voice and feel heard. Let me use my unique combination of knowledge, skills and experience in law and communication to help you achieve the peace of mind you deserve to move forward and thrive. Working together with me, you can find a solution that works for you more easily and quickly than you might imagine is possible right now.","[{'day': 'Monday', 'slots': ['09:00-11:00', '13:00-15:00', '16:00-18:00']}, {'day': 'Tuesday', 'slots': ['10:00-12:00', '14:00-16:00']}, {'day': 'Wednesday', 'slots': ['09:00-11:00', '13:00-15:00']}, {'day': 'Thursday', 'slots': ['10:00-12:00', '14:00-16:00', '17:00-19:00']}, {'day': 'Friday', 'slots': ['09:00-11:00', '12:00-14:00']}]",2024-05-26T09:44:17.463394,2024-05-26T09:44:17.463400
131,Christiaan Grosskopf,james22@whitney.com,"Profession/s Civil Engineering & ConstructionADR PractitionerAreas of expertise Construction contract disputes and their amicable settlement using dispute avoidance (Dispute Boards)Mediation and AdjudicationCountry of Practice Globally but preference in Southeast Asia, Europe and AfricaLanguagesEnglish and Afrikaans","Profession/s Civil Engineering & ConstructionADR PractitionerAreas of expertise Construction contract disputes and their amicable settlement using dispute avoidance (Dispute Boards)Mediation and AdjudicationCountry of Practice Globally but preference in Southeast Asia, Europe and AfricaLanguagesEnglish and Afrikaans",Independent ADR Practitioner for more than 5 years. More than 30 years of experience as a Project and Construction Manager on large civil construction projects where information mediation and dispute avoidance were daily occurrences. ,"During his career, Mr Grosskopf has worked mainly on construction sites in different parts of the world. He has extensive experience developing large, heavy civil projects including, dams & hydro and roads & bridges projects. He has been intimately involved in the contractual processes during many of these projects' procurement and execution stages. His extensive site experience and ability to evaluate situations as if being an impartial neutral allows him to identify potential problems and find ways to prevent these from developing into disputes through mediation and guiding parties to find solutions for disputes. ","[{'day': 'Monday', 'slots': ['09:00-11:00', '13:00-15:00', '16:00-18:00']}, {'day': 'Tuesday', 'slots': ['10:00-12:00', '14:00-16:00']}, {'day': 'Wednesday', 'slots': ['09:00-11:00', '13:00-15:00']}, {'day': 'Thursday', 'slots': ['10:00-12:00', '14:00-16:00', '17:00-19:00']}, {'day': 'Friday', 'slots': ['09:00-11:00', '12:00-14:00']}]",2024-05-26T09:44:17.464203,2024-05-26T09:44:17.464211
132,Christian Fox,juliebecker@gmail.com,"All areas of property dispute particularly high value commercial and super-prime residential property, as well as agricultural estates. General contract and commercial disputes.LanguagesEnglish ",ADR-ODR Accredited Civil-Commercial Mediator 2018 ,Currently Legal Counsel to a central London property management company. Responsibilities relating to mediation include resolving commercial tenant to tenant issues where the lease specifies that disputes will be handled by the landlord. ,"Christian brings a healthy dose of common sense to any mediation. He is well known for being unflappable, kind and able to draw on broad commercial experience.","[{'day': 'Monday', 'slots': ['09:00-11:00', '13:00-15:00', '16:00-18:00']}, {'day': 'Tuesday', 'slots': ['10:00-12:00', '14:00-16:00']}, {'day': 'Wednesday', 'slots': ['09:00-11:00', '13:00-15:00']}, {'day': 'Thursday', 'slots': ['10:00-12:00', '14:00-16:00', '17:00-19:00']}, {'day': 'Friday', 'slots': ['09:00-11:00', '12:00-14:00']}]",2024-05-26T09:44:17.464771,2024-05-26T09:44:17.464777
133,Claire Starza-Allen,higginsdoris@hotmail.com,"Commercial Specialist (including Mediation, Negotiation, Facilitation and Arbitration). I am an effective negotiator for high value/complex contractual arrangements. I have successfully resolved/de-escalated disputes to avoid formal dispute resolution whilst preserving relationships.Extensive experience of charity/social enterprise, construction, media and technology, health and central government including board facilitation and roles have included finance, risk management and governance.LanguagesEnglish",ADR Group (2016) Accredited Civil and Commercial Mediation.Called to the Bar at Lincolns Inn 2010.Chartered institute of Arbitrators – Accelerated Route to membership.RSA Fellow and IOD member.,"My qualifications in law, finance and business have given me the ability to lead and understand complex contractual arrangements. I have developed effective negotiation skills which allow me to identify and de-escalate risks. My experience and qualifications in dispute resolution and mediation ensure I am able to help all parties to understand how to work together to great effect.16 years’ experience in financial and commercial roles (including The Children’s Society, St Ives Group PLC,BMW, HEPA, David Wilson Home, Chartered Accountants, Morson International, Carillion) in different sectors including the not for profit, central government, and private sector including senior management and board roles. My qualifications in law (LLB, BVC), finance and business have given me the ability to understand complex contractual arrangements.I am at Trustee at The Advocacy Project and committee member at the British Red Cross. My previous roles include Head of Commercial at the Children’s Society. I am currently Group Contract Manager at St Ives Group an International Media Group with various international subsidiaries…I am also the CCO at a small social action consultancy and Pupil at the Worshipful Company of Arbitrators.",My mediation style is of a facilitative approach to allow the parties to work towards the best outcome for their issue whilst assisting them navigate complex and difficult matters. I am able to unpick complex facts and relay information in an accessible manner.,"[{'day': 'Monday', 'slots': ['09:00-11:00', '13:00-15:00', '16:00-18:00']}, {'day': 'Tuesday', 'slots': ['10:00-12:00', '14:00-16:00']}, {'day': 'Wednesday', 'slots': ['09:00-11:00', '13:00-15:00']}, {'day': 'Thursday', 'slots': ['10:00-12:00', '14:00-16:00', '17:00-19:00']}, {'day': 'Friday', 'slots': ['09:00-11:00', '12:00-14:00']}]",2024-05-26T09:44:17.465502,2024-05-26T09:44:17.465510
134,Clare Ramos,elizabethwalker@yahoo.com,Breakdown in working relationships between two parties and within teamsFace to face mediation and ODR specialistLanguagesEnglish,"2014 - present Director, Clare Ramos AssociatesWorkplace mediation and facilitation, and conflict resolution and mediation training.Working across all sectors, with particular expertise in universities and business schools, publishing and the arts.2012 - present Consultant, iOpener InstituteMediator for iOpener clients. Facilitator at 5 of world’s top 8 business schools, delivering, among other sessions, Managing Conflict, Listening & Observing, Emotional Intelligence on MBA/EMBA programmes.2009 - 2014 Senior Resolution Adviser, The TCM Group, London EC1Workplace mediator and trainer. Mediating across all sectors: blue-chip companies, City law firms, banks, universities, NHS trusts, charities and not-for-profit.2004 - 2011 Community mediator for Mediation Oxfordshire and Resolve BerkshireNeighbour and neighbourhood disputes involving discrimination, antisocial behaviour, harassment and differences in lifestyles. ","2014 - present Director, Clare Ramos AssociatesWorkplace mediation and facilitation, and conflict resolution and mediation training.Working across all sectors, with particular expertise in universities and business schools, publishing and the arts.2012 - present Consultant, iOpener InstituteMediator for iOpener clients. Facilitator at 5 of world’s top 8 business schools, delivering, among other sessions, Managing Conflict, Listening & Observing, Emotional Intelligence on MBA/EMBA programmes.2009 - 2014 Senior Resolution Adviser, The TCM Group, London EC1Workplace mediator and trainer. Mediating across all sectors: blue-chip companies, City law firms, banks, universities, NHS trusts, charities and not-for-profit.2004 - 2011 Community mediator for Mediation Oxfordshire and Resolve BerkshireNeighbour and neighbourhood disputes involving discrimination, antisocial behaviour, harassment and differences in lifestyles. ","When working with parties in conflict, I listen and help individuals explore their thoughts and feelings, and to understand their own situations, perspectives and needs. This leads to better and more constructive interactions, better understanding, more empathy and better outcomes. I understand that emotions can run high, and that one of the strongest drivers when in conflict is the need to feel heard. I am warm and pragmatic and find people trust me and value my empathetic style.Client Feedback‘Clare is always my first thought for university mediations,’ - Kim Frost, former Director of HR, University of London‘Clare carried out a very important and sensitive team mediation for the University with really good results. People now have a much better understanding of each other's needs and are working together effectively - which is exactly the outcome that was wanted.’ - Head of HR, University of Edinburgh","[{'day': 'Monday', 'slots': ['09:00-11:00', '13:00-15:00', '16:00-18:00']}, {'day': 'Tuesday', 'slots': ['10:00-12:00', '14:00-16:00']}, {'day': 'Wednesday', 'slots': ['09:00-11:00', '13:00-15:00']}, {'day': 'Thursday', 'slots': ['10:00-12:00', '14:00-16:00', '17:00-19:00']}, {'day': 'Friday', 'slots': ['09:00-11:00', '12:00-14:00']}]",2024-05-26T09:44:17.466044,2024-05-26T09:44:17.466050
135,Claudio Leasi,schroedercarmen@king-flores.net,"Profession/s With master's degrees in business administration, business law and business and or-ganizational psychology, I have been working as a CEO in the healthcare sector for over 20 years. I also work part-time as a lecturer and mediator and consult SMEs on strategic issues.Areas of expertise With experience in mediation, I offer versatile skills in numerous areas ranging from community and administrative affairs to politics, business, industry and service sectors. In the healthcare industry, I have successfully mediated between various stakeholders, as well as neighborhood-level disputes. My expertise also extends to working with NGOs and NPOs, small and medium-sized enterprises (SMEs), the sports sector, commerce, and workplace disputes. This broad experience enables me to find and implement constructive solutions to a wide range of conflicts.Country of Practice Switzerland, worldwide (on-site or online) after consultationLanguagesGerman and English","Profession/s With master's degrees in business administration, business law and business and or-ganizational psychology, I have been working as a CEO in the healthcare sector for over 20 years. I also work part-time as a lecturer and mediator and consult SMEs on strategic issues.Areas of expertise With experience in mediation, I offer versatile skills in numerous areas ranging from community and administrative affairs to politics, business, industry and service sectors. In the healthcare industry, I have successfully mediated between various stakeholders, as well as neighborhood-level disputes. My expertise also extends to working with NGOs and NPOs, small and medium-sized enterprises (SMEs), the sports sector, commerce, and workplace disputes. This broad experience enables me to find and implement constructive solutions to a wide range of conflicts.Country of Practice Switzerland, worldwide (on-site or online) after consultationLanguagesGerman and English","I have been a C-level manager in the healthcare industry for over two decades and know first-hand the challenges of conflict in business. During this time, I have also been engaged in dispute resolution at various organizations. For example, I have been involved with the Independent Counseling Center for the Aged (Switzerland) or as a lecturer for law and mediation at higher technical colleges. Since 2019, I have also been working as a part-time mediator with a focus on business mediation.","With many years of experience in mediation, I bring both deep expertise and a wide range of practical skills to the mediation process. My empathetic personality enables me to create a trusting and safe environment in which all parties feel heard and under-stood. What sets me apart is my multidisciplinary training: I have both a legal and a business psychology background. In this role, I use my multidisciplinary knowledge to bridge the different perspectives and needs of the parties and work towards finding mutually mediated and sustainable solutions.","[{'day': 'Monday', 'slots': ['09:00-11:00', '13:00-15:00', '16:00-18:00']}, {'day': 'Tuesday', 'slots': ['10:00-12:00', '14:00-16:00']}, {'day': 'Wednesday', 'slots': ['09:00-11:00', '13:00-15:00']}, {'day': 'Thursday', 'slots': ['10:00-12:00', '14:00-16:00', '17:00-19:00']}, {'day': 'Friday', 'slots': ['09:00-11:00', '12:00-14:00']}]",2024-05-26T09:44:17.467130,2024-05-26T09:44:17.467141
